{
  "schema_version": "p4-traffic-replay/v1",
  "fixture_id": "live-session-v1",
  "fixture_revision": 1,
  "fixture_class": "live-session",
  "manifest_digest": "sha256:305e75172438bc093fb544420df6bf08d8f43c767acb69c9fd7d9e479693e69f",
  "source": {
    "reference": "repo-generated://testkit/p4_switch/ptf/bounded-live-session",
    "acquired_at": "2026-08-12T00:00:00Z",
    "sha256": "sha256:375e153f559a0e60971afd128e7e7474c168e0afff74ce46e2e65f845c1581f2",
    "byte_size": 327,
    "producer": "bounded-live-session",
    "producer_version": "1",
    "citation": "MASI-NIDS deterministic bidirectional TCP state transcript",
    "license": "Apache-2.0",
    "use_conditions": "isolated module acceptance only",
    "redistribution": "approved",
    "payload_status": "synthetic",
    "sensitive_data": "synthetic-only",
    "malware_content": "benign-synthetic",
    "sanitization": "documentation-only addresses and deterministic sequence numbers",
    "retention_days": 30
  },
  "capture_inventory": null,
  "ground_truth": {
    "taxonomy": "p4-packet-action/v1",
    "producer": "masi-p4-testkit",
    "method": "bounded SYN, SYN-ACK, ACK, data, and FIN transcript with bidirectional port oracle",
    "granularity": "session",
    "coverage": 1.0,
    "ambiguity": "none",
    "expected_action": "forward",
    "expected_detection": "not-applicable",
    "digest": "sha256:477847260ce0be9d74dec26e4e943272d6167dd2b56df7721b5ad678de50d520"
  },
  "topology": {
    "target_class": "bmv2-software",
    "target_profile": "p4-stateless-firewall/v1",
    "p4_program_digest": "sha256:b228cf7423f083711d9f5c1ee4f097df868b452119d6c56a2f263e30c443823c",
    "p4info_digest": "sha256:23b6d3554ca11843b7e0324352ed09752f068a05abbecf16c16d08a9839d2241",
    "runner_namespace": "compose-runner-shares-switch-netns",
    "switch_namespace": "compose-switch-netns",
    "ingress_interface": "masi-p1",
    "ingress_port": 1,
    "expected_egress_interface": "masi-p2",
    "expected_egress_port": 2,
    "direction": "bidirectional",
    "client_side": "port1",
    "server_side": "port2",
    "port_map": {"1": "masi-s1", "2": "masi-s2", "510": "cpu"},
    "vlan": null,
    "mtu": 9500
  },
  "transformation": {
    "original_digest": "sha256:375e153f559a0e60971afd128e7e7474c168e0afff74ce46e2e65f845c1581f2",
    "direction_cache_digest": "sha256:e3970ea79505af238ac882c67a582343686e8762f426b153d4c3880a1cc44be6",
    "rewrite_digest": "sha256:ab64698b189841571bfe6f7c0a2a40397185891112749780c9456fac2a1ff9cd",
    "output_digest": "sha256:375e153f559a0e60971afd128e7e7474c168e0afff74ce46e2e65f845c1581f2",
    "seed": 1,
    "changes": {"mac": 0, "ip": 0, "port": 0, "vlan": 0, "ttl": 0, "sequence": 0, "checksum": 0, "length": 0, "mtu": 0}
  },
  "execution": {
    "traffic_mode": "fixed-pps",
    "runner_profile_id": "p4-traffic-replay-bmv2-compose/v1",
    "runner_backend_id": "bounded-live-session/v1",
    "runner_image_digest": "sha256:f0b02a81a6fc7e13b3d10695311663eb54aaf25e4487920e7de93b3b211d42dc",
    "requested_value": 100,
    "loop_count": 1,
    "max_duration_ms": 30000,
    "max_packets": 5,
    "max_wire_bytes": 8192,
    "preload": false,
    "warmup_packets": 0,
    "repeat": 1,
    "seed": 1,
    "deadline_ms": 30000
  },
  "impairment_environment": {
    "impairment_digest": "sha256:7639dbf0af7ae96cff188ca729ddf0d49d0c8321d49b3e279946eda9d6eb6c36",
    "netem": {"delay_ms": 0, "jitter_ms": 0, "loss_percent": 0, "duplicate_percent": 0, "reorder_percent": 0, "corrupt_percent": 0, "rate_mbps": null, "queue_limit": 1000, "seed": 1, "direction": "none"},
    "kernel_profile": "e2e-runner-compose-v1-host-kernel",
    "runner_environment": {
      "distribution": "Alpine Linux",
      "distribution_version": "3.24.1",
      "architecture": "x86_64",
      "iproute2": {
        "tool_version": "7.0.0",
        "package_version": "7.0.0-r0"
      },
      "tcpreplay": {
        "tool_version": "4.5.2",
        "package_version": "4.5.2-r1"
      }
    },
    "bmv2_image_digest": "sha256:24669f08df3583b0d170226f6969f1090235604ef6d5bb5e2b2bb06062d9a571",
    "mininet_version": null,
    "veth": true,
    "offloads": "disabled-or-not-applicable-to-raw-veth",
    "mtu": 9500,
    "cpu_profile": "isolated-module-unpinned-cpu-hold",
    "cgroup_profile": "compose-default-bounded-runner"
  },
  "oracles": {
    "sender_attempted": {"status": "required", "expected": 5, "tolerance": 0},
    "sender_accepted": {"status": "required", "expected": 5, "tolerance": 0},
    "test_ingress": {"status": "required", "expected": 5, "tolerance": 0},
    "dut_ingress": {"status": "required", "expected": 5, "tolerance": 0},
    "dut_egress": {"status": "required", "expected": 5, "tolerance": 0},
    "dut_drop": {"status": "required", "expected": 0, "tolerance": 0},
    "direct_counter": {"status": "not-applicable", "expected": 0, "tolerance": 0},
    "eligible_counter": {"status": "required", "expected": 5, "tolerance": 0},
    "independent_action_outcome": {"status": "required", "expected": 5, "tolerance": 0},
    "detection_result": {"status": "not-applicable", "expected": 0, "tolerance": 0}
  },
  "phases": ["prepare", "preflight-readback", "send-or-session", "observe-oracle", "cleanup"]
}
