{
  "schema_version": "p4-traffic-replay/v1",
  "fixture_id": "synthetic-flow-v1",
  "fixture_revision": 1,
  "fixture_class": "synthetic-flow",
  "manifest_digest": "sha256:6db63d1850db1a50fcbfc71c180470461fc12108d65b70fe56d0fdf38efbd719",
  "source": {
    "reference": "repo-generated://testkit/p4_switch/ptf/synthetic-flow",
    "acquired_at": "2026-08-12T00:00:00Z",
    "sha256": "sha256:d16e0ca6ccffb6db6485ce9a5cd9115d60969a3fb67a4298fccebf29b2850ebb",
    "byte_size": 4160,
    "producer": "ptf-scapy",
    "producer_version": "ptf-0.12.0-scapy-2.6.1",
    "citation": "MASI-NIDS bounded deterministic synthetic flow",
    "license": "Apache-2.0",
    "use_conditions": "isolated module acceptance only",
    "redistribution": "approved",
    "payload_status": "synthetic",
    "sensitive_data": "synthetic-only",
    "malware_content": "benign-synthetic",
    "sanitization": "documentation-only addresses and deterministic payload",
    "retention_days": 30
  },
  "capture_inventory": null,
  "ground_truth": {
    "taxonomy": "p4-packet-action/v1",
    "producer": "masi-p4-testkit",
    "method": "64 exact generated frames with sender, eligible-counter, and PTF outcome oracles",
    "granularity": "flow",
    "coverage": 1.0,
    "ambiguity": "none",
    "expected_action": "forward",
    "expected_detection": "not-applicable",
    "digest": "sha256:1a2ee0597500efeb393e4f7ca39aecb3c6ee17903b25ce6b07c559c48f54e9ce"
  },
  "topology": {
    "target_class": "bmv2-software",
    "target_profile": "p4-stateless-firewall/v1",
    "p4_program_digest": "sha256:b228cf7423f083711d9f5c1ee4f097df868b452119d6c56a2f263e30c443823c",
    "p4info_digest": "sha256:23b6d3554ca11843b7e0324352ed09752f068a05abbecf16c16d08a9839d2241",
    "runner_namespace": "compose-runner-shares-switch-netns",
    "switch_namespace": "compose-switch-netns",
    "ingress_interface": "masi-p1",
    "ingress_port": 1,
    "expected_egress_interface": "masi-p2",
    "expected_egress_port": 2,
    "direction": "port1-to-port2",
    "client_side": "not-applicable",
    "server_side": "not-applicable",
    "port_map": {"1": "masi-s1", "2": "masi-s2", "510": "cpu"},
    "vlan": null,
    "mtu": 9500
  },
  "transformation": {
    "original_digest": "sha256:d16e0ca6ccffb6db6485ce9a5cd9115d60969a3fb67a4298fccebf29b2850ebb",
    "direction_cache_digest": null,
    "rewrite_digest": "sha256:b38576d105ac4b7ebb839d932cfa75d3ee078f6e5df546084fd0720f7be1ef44",
    "output_digest": "sha256:d16e0ca6ccffb6db6485ce9a5cd9115d60969a3fb67a4298fccebf29b2850ebb",
    "seed": 1,
    "changes": {"mac": 0, "ip": 0, "port": 0, "vlan": 0, "ttl": 0, "sequence": 0, "checksum": 0, "length": 0, "mtu": 0}
  },
  "execution": {
    "traffic_mode": "fixed-pps",
    "runner_profile_id": "p4-traffic-replay-bmv2-compose/v1",
    "runner_backend_id": "ptf-scapy/v1",
    "runner_image_digest": "sha256:f0b02a81a6fc7e13b3d10695311663eb54aaf25e4487920e7de93b3b211d42dc",
    "requested_value": 1000,
    "loop_count": 1,
    "max_duration_ms": 30000,
    "max_packets": 64,
    "max_wire_bytes": 65536,
    "preload": false,
    "warmup_packets": 0,
    "repeat": 1,
    "seed": 1,
    "deadline_ms": 30000
  },
  "impairment_environment": {
    "impairment_digest": "sha256:7639dbf0af7ae96cff188ca729ddf0d49d0c8321d49b3e279946eda9d6eb6c36",
    "netem": {"delay_ms": 0, "jitter_ms": 0, "loss_percent": 0, "duplicate_percent": 0, "reorder_percent": 0, "corrupt_percent": 0, "rate_mbps": null, "queue_limit": 1000, "seed": 1, "direction": "none"},
    "kernel_profile": "e2e-runner-compose-v1-host-kernel",
    "runner_environment": {
      "distribution": "Alpine Linux",
      "distribution_version": "3.24.1",
      "architecture": "x86_64",
      "iproute2": {
        "tool_version": "7.0.0",
        "package_version": "7.0.0-r0"
      },
      "tcpreplay": {
        "tool_version": "4.5.2",
        "package_version": "4.5.2-r1"
      }
    },
    "bmv2_image_digest": "sha256:8b8655c2fb7bc5563706ee853fb668ba70457633cda7d93633d022b30b7ead42",
    "mininet_version": null,
    "veth": true,
    "offloads": "disabled-or-not-applicable-to-raw-veth",
    "mtu": 9500,
    "cpu_profile": "isolated-module-unpinned-cpu-hold",
    "cgroup_profile": "compose-default-bounded-runner"
  },
  "oracles": {
    "sender_attempted": {"status": "required", "expected": 64, "tolerance": 0},
    "sender_accepted": {"status": "required", "expected": 64, "tolerance": 0},
    "test_ingress": {"status": "required", "expected": 64, "tolerance": 0},
    "dut_ingress": {"status": "required", "expected": 64, "tolerance": 0},
    "dut_egress": {"status": "required", "expected": 64, "tolerance": 0},
    "dut_drop": {"status": "required", "expected": 0, "tolerance": 0},
    "direct_counter": {"status": "not-applicable", "expected": 0, "tolerance": 0},
    "eligible_counter": {"status": "required", "expected": 64, "tolerance": 0},
    "independent_action_outcome": {"status": "required", "expected": 64, "tolerance": 0},
    "detection_result": {"status": "not-applicable", "expected": 0, "tolerance": 0}
  },
  "phases": ["prepare", "preflight-readback", "send-or-session", "observe-oracle", "cleanup"]
}
